date,country,event,country_full_name,letter_spacing
2025-01-14,aq,"A Bordeaux, de 9 heures à 17 heures, à l'Hôtel de Région: Les*@*rencontres de l'économie circulaire. Recita est un programme initié et soutenu par la Région Nouvelle-Aquitaine, l'ADEME et la DREAL Nouvelle-Aquitaine. Il a pour objectif d'accompagner les entreprises et les collectivités dans leur transition vers l'économie circulaire.",Antarctique,0
2025-01-21,af,"Salon Benvivo, dès 8h30*@*à Kedge Business School, deuxième sommet biannuel s’articulera autour*@*de l’Economie, l’Ecologie,*@*la Société et la Santé.",Afghanistan,0
2025-01-30,al,"Rendez-vous traditionnel des acteurs de la santé au Pays-Basque la « conférence santé Sud Ouest/TV7 » avec TVPI est programmée cette année le 30 janvier. Ouvertes au public sur inscription, ces tables rondes se dérouleront à la CCi du Pays Basque à Bayonne de 14h à 18H.",Albanie,0
2025-02-04,sa,"Pour la journée mondiale contre le cancer proposée par l'OMS, Sud Ouest et TV7 s'associent à nouveau avec le CHU de Bordeaux pour organiser des conférences à suivre en ligne sur sudouest.fr. Deux rendez-vous seront à suivre dans la journée à midi et 18h pour faire le point sur « les innovations chirurgicales et traitements, et sur les innovations dans la prise en charge globale des patients ».","Arabie saoudite",0
