date,country,event,country_full_name,letter_spacing,adresse,phone,mail,web
2025-01-23,Gironde,"Bègles, 18 h- 20 h 30*@*3e édition, « R&D à l’industrie : défis et opportunités du transfert de technologie en pharma et biotech », porté par le French Tech de Bordeaux.  ",Gironde,0,"Jardin by Unitec, La Cité Numérique",0635241545,vvvvv@vvvvv,www.flaticon.com
2025-01-23,NouvelleAquitaine,"Un webinaire se déroula sur le thème de « Comment réduire l'impact des matières premières ? » organisé par Récita, le réseau de l'économie circulaire en Nouvelle-Aquitaine. Comment réduire cet impact ? Quelles stratégies peuvent être mises en place ? L’éco-organisme Refashion propose un webinaire dédié à l’éco-conception des produits textiles avec un focus sur la minimisation de l’impact de la consommation matière lors de la conception et de la fabrication des vêtements. Le CETI (Centre Européen des Textiles Innovants) interviendra lors de ce webinaire.",Nouvelle-Aquitaine,0,xxxxx,,,"Inscription sur recita.org"
2025-01-27,NouvelleAquitaine,"À partir de fin janvier, les adhésions ouvriront pour faire partie l’Association Régionale des Entreprises Alimentaires de NouvelleAquitaine (AREA) , anciennement connue sous le nom de l'ARIA qui, donc, change de nom. Deux-cents entreprises du secteur agroalimentaire sont réunies dans ce réseau d'entreprise produisant durablement et localement. ",Nouvelle-Aquitaine,0,,,veronique.hucault@area-na.com,
2025-05-25,PyreneesAtlantiques,"Rendez-vous traditionnel des acteurs de la santé au Pays basque la conférence Santé « Sud Ouest » /TV7 avec TVPI est programmée cette année le 30 janvier. Ouvertes au public sur inscription, ces tables rondes se dérouleront à la CCI du Pays basque à Bayonne de 14 heures à 18 heures.",Pyrénées-Atlantiques,0,,,ommunication-event@sudouest.fr,
2025-02-04,Gironde,"Pour la journée mondiale contre le cancer proposée par l'OMS, *@*« Sud Ouest » et TV7 s'associent*@*à nouveau avec le CHU de Bordeaux pour organiser des conférences en ligne sur sudouest.fr. Deux rendez-vous seront à suivre dans la journée à midi et 18 heures pour faire le point  sur « les innovations chirurgicales et traitements », et sur « les innovations dans la prise en charge globale des patients ». ",Gironde,0,,,communication-event@sudouest.fr,
2025-02-04,CharenteMaritime,"Organisée par « Sud Ouest » et la CCI Charente-Maritime,la soirée des prix de l'économie Emergence en Charente-Maritime est programmée cette année le 8 avril à La Rochelle. Mais cet événement est depuis l'an passé décliné en soirées locales. La première a lieu le 4 février à l'espace Beauséjour à Châtelaillon, à 18 heures.",Charente-Maritime,0,,,,https://emergence.charente-maritime.cci.fr/billetterie-chatelaillon-plage/
,NouvelleAquitaine,"Jusqu'au 25 mai, l'Agence de l'eau Adour Garonne invite les entreprises et les citoyens à donner leur avis sur la gestion du cycle de l'eau.",Nouvelle-Aquitaine,0,,,,eau-grandsudouest.com
